{
  "$schema": "https://json-schema.org/draft/2020-12/schema",
  "$id": "https://cloudai-platform.example/schemas/ai-supplier-readiness/supplier-readiness-decision.schema.json",
  "title": "Synthetic AI supplier readiness decision",
  "description": "Deterministic, metadata-only decision derived from a synthetic supplier assessment.",
  "type": "object",
  "additionalProperties": false,
  "required": [
    "schemaVersion",
    "assessmentId",
    "decision",
    "reasonCodes",
    "evaluatedAt",
    "reviewBy",
    "evidenceReferences"
  ],
  "properties": {
    "schemaVersion": { "const": "1.0" },
    "assessmentId": {
      "type": "string",
      "pattern": "^[a-z0-9][a-z0-9-]{2,80}$"
    },
    "decision": {
      "type": "string",
      "enum": ["eligible", "conditional", "not-eligible"]
    },
    "reasonCodes": {
      "type": "array",
      "minItems": 1,
      "maxItems": 1,
      "uniqueItems": true,
      "items": {
        "type": "string",
        "enum": [
          "evidence-complete",
          "bounded-remediation-required",
          "required-evidence-family-missing",
          "evidence-applicability-conflict",
          "critical-evidence-missing",
          "evidence-missing",
          "conditional-boundary-incomplete",
          "current-requirement-unmet"
        ]
      }
    },
    "evaluatedAt": { "type": "string", "format": "date-time" },
    "reviewBy": { "type": "string", "format": "date-time" },
    "evidenceReferences": {
      "type": "array",
      "minItems": 1,
      "uniqueItems": true,
      "items": { "type": "string", "format": "uri" }
    }
  }
}
