{
  "schemaVersion": "1.0",
  "assessmentId": "synthetic-missing-critical-evidence",
  "decision": "not-eligible",
  "reasonCodes": ["critical-evidence-missing"],
  "evaluatedAt": "2026-08-31T01:00:00.000Z",
  "reviewBy": "2026-09-30T00:00:00.000Z",
  "evidenceReferences": ["https://example.com/cloudai-platform/supplier-evidence/missing-critical-evidence"]
}
